id,title,text,score,comments,created,subreddit,url
1s4cjut,Any Recommendations for a Customizable Robo Advisor?,"As part of my jobs compensation packages I get stocks vesting on a monthly basis, and there is an enrollment window in May for automatically selling shares upon vest. I would like to do this to avoid concentration risk, and transfer the funds to a brokerage account.

Through work I also have access to free sessions with a financial advisor so I’ve been talking to him about which funds and allocation percentages make sense for me given my risk tolerance and financial goals.

I only want to be medium hands on with this account, so something he mentioned was robo advisors that automatically do rebalancing and tax loss harvesting (something I would really like to not have to do manually). 

Does anyone have recommendations for a robo advisor that has those features, but allows you to select which investments to make? From the Googling I’ve done about it, it seems like Wealthfront, Betterment, and M1 finance might be good options? Anyone have experience with these? 

To give a dollar amount reference incase it helps, my account is quite small now (\~$9.5k), but will likely exceed $25k in 7 months.",3,2,2026-03-26 22:07:02,investing,https://www.reddit.com/r/investing/comments/1s4cjut/any_recommendations_for_a_customizable_robo/
1s4fsmx,Gut check on tax loss harvest,"Need a quick gut check that this all makes sense.

Left my FA in January to go on my own. Sold all positions in a 15+ fund portfolio to move self-managed 80/20 VTI/VXUS. Put the 1.3% advisor fee and 0.3% ETF fees back into my pocket.

I incurred $44k in realized gains with the liquidation. Estimated tax payment is due before 4/15 - roughly $13k between Fed &amp; State. Don't need to liquidate any more positions to pay this, I have had it off to the side in cash.

Current unrealized losses on the year so far are $12,500.

I want to liquidate the VTI to move to FSKAX and liquidate the VXUX to move to FTIHX – are these “substantially identical”? Seems like not even the IRS knows.

Turn off DRIP to avoid wash rule.

Turn my $44k realized gains into $31.5k. Submit estimated tax payment on only $31.5k now.

If the market continues on it’s downward trajectory, wait until I can lock in another decently large loss to switch back to VTI/VXUS (after 31+ days), in hopes of recouping some (or all) of the estimated tax payment with my refund during tax season next year.

All makes sense? Am I missing anything?",2,19,2026-03-27 00:02:51,investing,https://www.reddit.com/r/investing/comments/1s4fsmx/gut_check_on_tax_loss_harvest/
1s372d0,Robinhood Announces $1.5 Billion Share Buyback Program as Stock Slides 39%,"Source: [https://beincrypto.com/robinhood-buyback-hood-stock-decline-2026/](https://beincrypto.com/robinhood-buyback-hood-stock-decline-2026/)

HOOD tripled in 2025 then lost 39% year-to-date in 2026, closing at a yearly low of $69.08, down over 54% from its October all-time high of $152.46. Robinhood's board responded by approving a $1.5 billion share repurchase program to be executed over three years, adding $1.1 billion in fresh buyback capacity.

  
The company also quietly expanded its JPMorgan credit facility from $2.65 billion to $3.25 billion, expandable to $4.87 billion. Wall Street analysts still hold a strong buy rating with a 12-month price target implying roughly 79% upside from current levels.

  
The question is whether this buyback signals genuine undervaluation or just management trying to catch a falling knife.",654,257,2026-03-25 16:04:53,investing,https://www.reddit.com/r/investing/comments/1s372d0/robinhood_announces_15_billion_share_buyback/
1s40xde,Sumitomo Electric vs AXTI,"What are your opinions on Sumitomo Electric?  They compete with AXTI in producing InP, but despite being Japanese company, they produce InP in Oregon and don't face Chinese export controls.  I would have to think an American company that is looking for a steady supply would have to go with Sumitomo.  I don't see how Sumitomo does not dominate this market.  I guess perhaps AXTI although being an American company could be China's biggest supplier of InP.",8,2,2026-03-26 13:05:28,investing,https://www.reddit.com/r/investing/comments/1s40xde/sumitomo_electric_vs_axti/
1s3oodt,is 2026 the year of renewable energy?,"With everything going on in Iran and the strait of hormuz, and the increasing demand for energy from AI, will renewable energy sector be the winner of 2026? 

  
The Phillippines is said to only have enough fuel for 45 days, will this be the event that finally accelerates the world towards renewable energy? ",43,98,2026-03-26 03:25:54,investing,https://www.reddit.com/r/investing/comments/1s3oodt/is_2026_the_year_of_renewable_energy/
1s4dwwv,First time investing through war,As the title says.  Im still new to this.  Just past few years.  If the stuff in Iran wasnt happening I would still be pretty confident dca im to what I have been already.  Prices are down to about what they were in September.  But Im not sure how this would really go if this war stretches on and wondering should I hold out or just stay the course,0,29,2026-03-26 22:55:51,investing,https://www.reddit.com/r/investing/comments/1s4dwwv/first_time_investing_through_war/
1s3eemc,"$70k Investment: Moving from interest savings accounts to ETFs, bad time?","I have had my money in regular interest savings accounts and buying property for a few years. I am looking to put $50-70k into 80% Vanguard All-world ETF and 20% into EM and All world Tech ETFs. 

I know timing the market is not as important as time in the market, *but timing could be nice too!*

I am intent to leave this money in the funds long term. 

**I’m no market speculator, hence the ETFs, if you were in my position would you wait out the current uncertainty or just go for it?** ",54,62,2026-03-25 21:14:51,investing,https://www.reddit.com/r/investing/comments/1s3eemc/70k_investment_moving_from_interest_savings/
1s3y67z,"If Arctic shipping routes open up in the future, which industry / stock will likely to benefit?","With all the talk about Arctic routes opening up, im trying to figure out what’s actually investable here. I can think of shipping and defense industry with the tension around there, but what else?

Also I was wondering if it’s a bit too early to invest in this given all the uncertainties. What are your thoughts?",6,8,2026-03-26 10:23:40,investing,https://www.reddit.com/r/investing/comments/1s3y67z/if_arctic_shipping_routes_open_up_in_the_future/
1s3bgm8,What's one investing principle you wish you understood earlier?,"I have been reading a lot about investing lately and notice that most people's advice boils down to a few key principles, but everyone seems to have one specific lesson that really changed how they approach the market.

For those who have been investing for a while: what's one concept, strategy, or mindset shift that you wish you had understood earlier in your journey? Could be about risk, time horizon, valuation, or even just behavior.

Hoping to learn from the experience in this community.",47,92,2026-03-25 19:26:24,investing,https://www.reddit.com/r/investing/comments/1s3bgm8/whats_one_investing_principle_you_wish_you/
1s4j3px,Hold or sell then buy again later?,If im investing long term for retirement (I’m 28 right now)… should I just be holding onto stocks or sell now then buy them back in a couple months at a lower price? I imagine the US/Israeli terrorism in Iran is going to cause the market to continue to drop for a while.,0,58,2026-03-27 02:06:02,investing,https://www.reddit.com/r/investing/comments/1s4j3px/hold_or_sell_then_buy_again_later/
1s2w0em,🚨 SpaceX aims to file IPO as soon as this week,"SpaceX is expected to file its IPO prospectus within the next two weeks with a potential June listing.

The offering could raise over $75B with more than 20% of shares allocated to individual investors. Could be one of the biggest retail-access IPOs ever

Curious how pricing ends up and whether demand pushes this even higher

Source: Blossom / The Information",339,206,2026-03-25 06:13:11,investing,https://www.reddit.com/r/investing/comments/1s2w0em/spacex_aims_to_file_ipo_as_soon_as_this_week/
1s3k30f,History of the launch of the first ETFs in Europe. All worth a watch,"Ever wondered about what the first **#ETF** was in Europe and how it was created. Well now you can hear from [Manooj Mistry](https://www.linkedin.com/feed/#) who was the architect behind the first ETFs in Europe 25 years ago! 



It's a fantastic story and anyone involved in the industry today should take time out to hear it first hand. [https://youtu.be/e7RFc6arZew?si=H8qg14\_L\_3BjaEmZ](https://youtu.be/e7RFc6arZew?si=H8qg14_L_3BjaEmZ) **#etfs** ",11,0,2026-03-26 00:37:28,investing,https://www.reddit.com/r/investing/comments/1s3k30f/history_of_the_launch_of_the_first_etfs_in_europe/
1rhtjtk,Rate My Portfolio - r/Stocks Quarterly Thread March 2026,"Please use this thread to discuss your portfolio, learn of other stock tickers &amp; portfolios like [Warren Buffet's](https://buffett.online/en/portfolio/), and help out users by giving constructive criticism.

Why quarterly?  Public companies report earnings quarterly; many investors take this as an opportunity to rebalance their portfolios.  We highly recommend you do some reading:  Check out our wiki's list of [relevant posts &amp; book recommendations.](https://www.reddit.com/r/stocks/wiki/index/#wiki_relevant_posts.2C_books.2C_wiki_recommendations)

You can find stocks on your own by using a scanner like your broker's or [Finviz.](https://finviz.com/screener.ashx)  To help further, here's a list of [relevant websites.](https://www.reddit.com/r/stocks/wiki/index/#wiki_relevant_websites.2Fapps)

If you don't have a broker yet, see our [list of brokers](https://www.reddit.com/r/stocks/wiki/index/#wiki_brokers_for_investing) or search old posts.  If you haven't started investing or trading yet, then setup your [paper trading to learn basics like market orders vs limit orders.](https://www.reddit.com/r/stocks/wiki/index/#wiki_is_there_a_way_to_practice.3F)

Be aware of [Business Cycle Investing](https://eresearch.fidelity.com/eresearch/markets_sectors/sectors/si_business_cycle.jhtml?tab=sibusiness) which Fidelity issues updates to the state of global business cycles every 1 to 3 months (note: Fidelity changes their links often, so search for it since their take on it is enlightening).  [Investopedia's take on the Business Cycle](https://www.investopedia.com/articles/investing/061316/business-cycle-investing-ratios-use-each-cycle.asp).

If you need help with a falling stock price, check out Investopedia's [The Art of Selling A Losing Position](https://www.investopedia.com/articles/02/022002.asp) and their [list of biases.](https://www.investopedia.com/articles/stocks/08/capital-losses.asp)

Here's a list of all the [previous portfolio stickies.](https://www.reddit.com/r/stocks/search?q=author%3Aautomoderator+title%3A%22Rate+My+Portfolio%22&amp;restrict_sr=on&amp;sort=new&amp;t=all)",9,14,2026-03-01 15:30:44,stocks,https://www.reddit.com/r/stocks/comments/1rhtjtk/rate_my_portfolio_rstocks_quarterly_thread_march/
1s42q3o,"r/Stocks Daily Discussion &amp; Options Trading Thursday - Mar 26, 2026","This is the daily discussion, so anything stocks related is fine, but the theme for today is on stock options, but if options aren't your thing then just ignore the theme.

Some helpful day to day links, including news:

* [Finviz](https://finviz.com/quote.ashx?t=spy) for charts, fundamentals, and aggregated news on individual stocks
* [Bloomberg market news](https://www.bloomberg.com/markets)
* StreetInsider news:
* [Market Check](https://www.streetinsider.com/Market+Check) - Possibly why the market is doing what it's doing including sudden spikes/dips
* [Reuters aggregated](https://www.streetinsider.com/Reuters) - Global news

-----

Required info to start understanding options:

* [Call option Investopedia video](https://www.investopedia.com/terms/c/calloption.asp) basically a call option allows you to buy 100 shares of a stock at a certain price (strike price), but without the obligation to buy
* [Put option Investopedia video](https://www.investopedia.com/terms/p/putoption.asp) a put option allows you to sell 100 shares of a stock at a certain price (strike price), but without the obligation to sell
* Writing options switches the obligation to you and you'll be forced to buy someone else's shares (writing puts) or sell your shares (writing calls)

See the following word cloud and click through for the wiki:

[Call option - Put option - Exercising an option - Strike price - ITM - OTM - ATM - Long options - Short options - Combo - Debit - Credit or Premium - Covered call - Naked - Debit call spread - Credit call spread - Strangle - Iron condor - Vertical debit spreads - Iron Fly](https://www.reddit.com/r/stocks/wiki/options-themed-post)

If you have a basic question, for example ""what is delta,"" then google ""investopedia delta"" and click the investopedia article on it; do this for everything until you have a more in depth question or just want to share what you learned.

See our past [daily discussions here.](https://www.reddit.com/r/stocks/search?q=author%3Aautomoderator+%22r%2Fstocks+daily+discussion%22&amp;restrict_sr=on&amp;sort=new&amp;t=all)  Also links for:  [Technicals](https://www.reddit.com/r/stocks/search?q=author%3Aautomoderator+title%3Atechnicals&amp;restrict_sr=on&amp;include_over_18=on&amp;sort=new&amp;t=all) Tuesday, [Options Trading](https://www.reddit.com/r/stocks/search?q=author%3Aautomoderator+title%3Aoptions&amp;restrict_sr=on&amp;include_over_18=on&amp;sort=new&amp;t=all) Thursday, and [Fundamentals](https://www.reddit.com/r/stocks/search?q=author%3Aautomoderator+title%3Afundamentals&amp;restrict_sr=on&amp;include_over_18=on&amp;sort=new&amp;t=all) Friday.",13,667,2026-03-26 15:00:25,stocks,https://www.reddit.com/r/stocks/comments/1s42q3o/rstocks_daily_discussion_options_trading_thursday/
1s4kekg,Trump's pinky promises are a desperate stalling tactic to keep equities markets up,"Trump has TACO'd and pinky promised not to bomb Iran's energy facilities for another 10 days:

https://www.dw.com/en/iran-war-trump-extends-pause-on-energy-sector-strikes/live-76535412

This could mean a few things:

1. Trump never planned to do it in the first place, and this is another TACO.

2. Trump needs more time to organize forces in the Middle East for an attack.

3. Trump is lying, and will attack Iran.

Either way, it seems to me that Trump, who used to call Obama an idiot for publicly announcing his intentions with respect to military operations, is doing this to manipulate markets during the war, whatever his end game. He even recently bragged that markets have not collapsed as badly as he thought.

The problem for Trump is that headline driven prices of equities markets and paper traded oil futures are about to be overcome by real physically traded demand for oil by refineries who are looking at weeks (and months, since refineries that came offline will take weeks to come back) of empty oceans behind the cargo ships that take 30-40 days to transit, leading to supply shortages.

In other words, oil is about to spike hard, and equities markets are about to crash hard. Trump can't Truth Social his way out of that mess, and it is already a done deal. Trump knows it. The Iranians know it. And the market makers likely know it too.",636,128,2026-03-27 02:55:22,stocks,https://www.reddit.com/r/stocks/comments/1s4kekg/trumps_pinky_promises_are_a_desperate_stalling/
1s4j12a,Trump extends pause on attacking Iran Energy Facilities to April 6th.,"https://www.cbsnews.com/live-updates/iran-war-trump-israel-tehran-denies-ceasefire-talks-strait-of-hormuz/

https://www.cnbc.com/2026/03/26/trump-iran-war-oil-energy-pause.html

“As per Iranian Government request, please let this statement serve to represent that I am pausing the period of Energy Plant destruction,” Trump said in a Truth Social post.

“Talks are ongoing and, despite erroneous statements to the contrary by the Fake News Media, and others, they are going very well. Thank you for your attention to this matter!”",529,160,2026-03-27 02:03:10,stocks,https://www.reddit.com/r/stocks/comments/1s4j12a/trump_extends_pause_on_attacking_iran_energy/
1s4ha2p,Big Tech Sell Off,"Big tech is taking a significant hair cut with a lot of stocks selling off today. At the time of writing this Microsoft is down 1.5%. Google is down 3.3%. Meta is down 7.7%. Amazon is down 1.7%. A lot of these stocks too are down significantly ytd as well. The only one holding up right now is Apple. Broader market is also selling off today too.

Is anybody picking up any companies today? I have seen a lot of Reddit talk about Microsoft recently which makes sense since Microsoft has been part of the Software Slump this year as a result has taken a significant hit ytd. Any deals people are looking at?

Edit: The top ones that are mentioned is Microsoft, Meta, Micron, and Reddit. Good luck everyone!",429,314,2026-03-27 00:57:43,stocks,https://www.reddit.com/r/stocks/comments/1s4ha2p/big_tech_sell_off/
1s4jbxq,Liberation Day 2.0,"It's that point of the year where stocks crash

Last year it was April 2nd, 2025

Today is March 26th, 2026. Almost a year ago

What I learned last year is buy as much as you can because in a few months stocks are going back up.",203,296,2026-03-27 02:14:35,stocks,https://www.reddit.com/r/stocks/comments/1s4jbxq/liberation_day_20/
1s4cno5,Trump says oil and stock market reaction to Iran conflict not as severe as he expected,"[Source from CNBC](https://www.cnbc.com/2026/03/26/trump-iran-war-oil-stocks.html)

&gt; Addressing Treasury Secretary Scott Bessent, the president said oil prices “have not gone up as much as I thought, Scott, to be honest with you. It’s all going to come back down to where it was and probably lower.” 

&gt; Trump has said the economic damage will reverse once the war ends.
&gt;
&gt;“My predictions have been right,” he said.",417,164,2026-03-26 22:10:54,stocks,https://www.reddit.com/r/stocks/comments/1s4cno5/trump_says_oil_and_stock_market_reaction_to_iran/
1s4alpu,Meta stock is falling this AM (-5.6%),"Meta Platforms (META) stock fell in early trading on March 26, 2026, primarily due to a convergence of legal setbacks, announced layoffs, and ongoing investor concerns regarding high capital expenditures. The combination of these factors, along with a general pullback in the ""Magnificent 7"" tech sector, put significant pressure on Meta shares this morning.

What are we thinking about this?",237,268,2026-03-26 20:56:25,stocks,https://www.reddit.com/r/stocks/comments/1s4alpu/meta_stock_is_falling_this_am_56/
1s4idvj,If US put boots on the ground what happens to oil stocks?,"Iran will obviously react and the shit will hit the fan and the war will last even longer. So the market will definitely tank like crazy if they go in but will oil stocks bounce or be caught up in the carnage?

Insert Warren Buffett - It's over! Panic sell everything meme",72,157,2026-03-27 01:39:04,stocks,https://www.reddit.com/r/stocks/comments/1s4idvj/if_us_put_boots_on_the_ground_what_happens_to_oil/
1s45m79,Is market overreacting about Microsoft?,"It is getting hammered so much lately, even on market green days microsoft tends to end up red, but I really don't see why. 

Like sure, for retail customers it's products become shit, there's no lying about that, but also, microsoft dosen't care about simple bob and his home PC running windows. Majority of microsoft earnings comes from big corpo and Azure and I didn't see any indicator of this failing apart.

So did I missed something and microsoft really is in trouble or current down trend is some kind of buildup before earnings next month, which probably (again) be positive? ",270,227,2026-03-26 17:36:46,stocks,https://www.reddit.com/r/stocks/comments/1s45m79/is_market_overreacting_about_microsoft/
1s3ryee,Jury orders Meta and Google to pay woman $6 million in social media addiction trial,"""A California jury on Wednesday found that Meta and Google's YouTube were to blame for the depression and anxiety of a woman who compulsively used social media as a small child, awarding her $6 million in a rare verdict holding Silicon Valley accountable for its role in fueling a youth mental health crisis.

Over a more than month-long trial in Los Angeles, the jury of five men and seven women heard competing narratives about what role social media platforms played in the mental health struggles of a woman identified as KGM, or Kaley, a now-20-year-old from Chico, Calif., who said she first started using YouTube at 6 years old and Instagram when she was 11.

KGM's legal team showed the jury internal documents from Meta in which [CEO Mark Zuckerberg](https://www.npr.org/2026/02/18/nx-s1-5717117/zuckerberg-testimony-social-media-addiction-trial) and other executives described the company's efforts to attract and keep kids and teens on its platforms. One document said: ""If we wanna win big with teens, we must bring them in as tweens,"" and another internal memo showed that 11-year-olds were four times as likely to keep coming back to Instagram, compared with competing apps, despite the platform requiring users to be at least 13 years old.

The trial is a test case, known as a bellwether, tied to about 2,000 other pending lawsuits brought by parents and school districts arguing that social media giants should be considered manufacturers of defective products for hooking a generation of young people to social media feeds.""

Source: [https://www.npr.org/2026/03/25/nx-s1-5746125/meta-youtube-social-media-trial-verdict](https://www.npr.org/2026/03/25/nx-s1-5746125/meta-youtube-social-media-trial-verdict)

2000 lawsuits, assuming worst case scenario all getting penalized for 6 million would be 12 billion. Simultaneously, there are whole countries suing or banning social media all together for kids under 16. Australia just announced the ban last December, with UK and France fast tracking and testing their own versions of banning it as well, with multiple US states suing them too.

Another jury sided with the state of New Mexico that sued[ Meta for 375 million](https://www.npr.org/2026/03/24/g-s1-115019/new-mexico-meta-children-mental-health) a day earlier for ""Meta knowingly harmed children's mental health and concealed what it knew about child sexual exploitation on its social media platforms"".

Is this the canary in the coal mine for social media giants? What are people's thoughts on this?",785,324,2026-03-26 05:35:20,stocks,https://www.reddit.com/r/stocks/comments/1s3ryee/jury_orders_meta_and_google_to_pay_woman_6/
1s4mqld,What’s going on with Micron (MU)?,It had amazing earnings but it’s been dropping ever since. After earnings I thought maybe people were selling to take the gain but now - what is going on? Is it just general “the whole market is down” stuff or is it something more specific to the sector?,9,45,2026-03-27 04:26:13,stocks,https://www.reddit.com/r/stocks/comments/1s4mqld/whats_going_on_with_micron_mu/
1s4ck26,"If the addiction elements of social media platforms has to be curtailed, what are the companies worth?","It seems like a lot of people are social media addicts. How many more lawsuits will there be against META? It seems endless. But the rub is, if the addiction aspect of these platforms is shut down, how much are the companies worth?

Not to mention way too many elderly individuals are being hit with scams on META's platforms and they are doing little to curb it. How long before those lawsuits emerge?

[https://www.npr.org/2026/03/25/nx-s1-5746125/meta-youtube-social-media-trial-verdict](https://www.npr.org/2026/03/25/nx-s1-5746125/meta-youtube-social-media-trial-verdict)

The entire company model is built on addiction and they have known how it effects brains for a long time.

[https://www.nytimes.com/2018/10/26/style/phones-children-silicon-valley.html](https://www.nytimes.com/2018/10/26/style/phones-children-silicon-valley.html)

",19,34,2026-03-26 22:07:15,stocks,https://www.reddit.com/r/stocks/comments/1s4ck26/if_the_addiction_elements_of_social_media/
1s3udrf,Any in all cash?,It seems that most people are expecting a market downturn and / or crash. Every day there’s negative sentiment and news. Would like to know how many are in all cash vs investment? Any ideas? What’s the best mix of wealth preservation?,228,545,2026-03-26 07:21:10,stocks,https://www.reddit.com/r/stocks/comments/1s3udrf/any_in_all_cash/
1s3qhfl,Found some stock certificates in my late grandfathers stuff bought from PC Financial Network in 1993.,"I was wondering where I would go about finding out if the shares were still valid and who they would be owned through since PC Financial Network is no longer around thanks. 

For those interested the tickers are CMP and GRE PRB",269,25,2026-03-26 04:35:15,stocks,https://www.reddit.com/r/stocks/comments/1s3qhfl/found_some_stock_certificates_in_my_late/
1s49wbr,Blackrock -  investors may be underestimating the risks,"# Takeaways - stemming from the Iran war, which are likely to weigh on growth and drive inflation higher.

* Kapito warned that growth could be hit and inflation may rise even if the war ends soon, and that oil may still spike to $150 a barrel as disrupted supply chains take time to return to full capacity.
* Apollo Global Management’s President Jim Zelter also cautioned about heightened risks of a US recession and to the credit cycle from a prolonged conflict, saying US consumers are already showing signs of distress.",15,12,2026-03-26 20:31:22,stocks,https://www.reddit.com/r/stocks/comments/1s49wbr/blackrock_investors_may_be_underestimating_the/
