id,title,text,score,comments,created,subreddit,url
1rz4bnm,Weekly Earnings Thread 3/23 - 3/27,,92,620,2026-03-21 00:03:31,wallstreetbets,https://i.redd.it/b0kk1olsu8qg1.jpeg
1s4i264,"What Are Your Moves Tomorrow, March 27, 2026",This post contains content not supported on old Reddit. [Click here to view the full post](https://sh.reddit.com/r/wallstreetbets/comments/1s4i264),204,7145,2026-03-27 01:27:27,wallstreetbets,https://www.reddit.com/r/wallstreetbets/comments/1s4i264/what_are_your_moves_tomorrow_march_27_2026/
1s4ixtz,Netflix raises prices across all streaming plans,,2256,701,2026-03-27 01:59:47,wallstreetbets,https://www.cnbc.com/amp/2026/03/26/netflix-raises-prices-across-all-streaming-plans.html
1s4hice,"Exclusive: Musk rewrites IPO playbook with large slice of SpaceX stock for retail investors, source says",,1064,256,2026-03-27 01:06:34,wallstreetbets,https://www.reuters.com/business/finance/musk-rewrites-ipo-playbook-with-large-slice-spacex-stock-retail-investors-source-2026-03-26/
1s4fz9s,Wife will divorce me if she finds out,,1130,836,2026-03-27 00:09:26,wallstreetbets,https://i.redd.it/9v0wczjbpfrg1.jpeg
1s4o98h,"Sure, Iran requested for an extension (at market close wink wink).","So Iran requested for a 7-day extension to relocate their nuclear, command assets into more hardened deep-state bunkers and shore up backup power, and Trump said, ""no no no, take 10 instead"". The enemy will use this time to eliminate the ""clean strike"" options the Pentagon had on the table last week. Maybe that's Trump thanking back Iran for their ""gift"".

If you're about to buy this dip, you are the exit liquidity for his billionaire friends. It's a synthetic soft landing. Trump is talking the market up to flush short-sellers before the next phase of the war. The ceasefire isn't the end of the trade, it's the setup for it.

Positions:

SPX $6,400 Puts – Exp. 04/17/26 

USO $125 Calls – Exp. 04/17/26",401,105,2026-03-27 05:27:34,wallstreetbets,https://www.reddit.com/r/wallstreetbets/comments/1s4o98h/sure_iran_requested_for_an_extension_at_market/
1s4iol8,PLEASE BENJAMIN NETANYAHU MY CALLS ARE COOKED,My ex is currently begging on Reddit for money like a brokie and I’m about to be too ig 🤡 (no I didn’t lose it all),614,133,2026-03-27 01:50:02,wallstreetbets,https://i.redd.it/26k8w6m97grg1.jpeg
1s4lo1w,An oldie but a goodie feat. Chamath,,422,79,2026-03-27 03:43:51,wallstreetbets,https://v.redd.it/tynrcflkrgrg1
1s4ege5,“Just buy shares” they said.,"This is why you stick to gambling on options. 

I could’ve at least had some fun lighting my money on fire at the casino. ",940,394,2026-03-26 23:15:01,wallstreetbets,https://i.redd.it/v1rpfat5ffrg1.png
1s4l8id,Trump Pause Lifts Futures After 'Serious' Sell-Off,,311,242,2026-03-27 03:27:35,wallstreetbets,https://www.investors.com/market-trend/stock-market-today/dow-jones-futures-oil-prices-trump-iran-war-meta-google-microsoft/?src=A00220
1s4dts3,Samsung and SK Hynix Stocks Plunge Following Google's TurboQuant AI Memory Tech Reveal - Parameter,,592,78,2026-03-26 22:52:39,wallstreetbets,https://parameter.io/samsung-and-sk-hynix-stocks-plunge-following-googles-turboquant-ai-memory-tech-reveal/
1s4f3jf,"Microsoft freezes hiring in major cloud, sales groups, The Information reports","Microsoft freezes hiring in major cloud, sales groups, The Information reports

By Reuters

March 26, 20265:46 PM GMTUpdated 5 mins ago

56th annual World Economic Forum (WEF) meeting, in Davos

A man uses a phone next to a Microsoft logo during the 56th annual World Economic Forum (WEF) meeting, in Davos, Switzerland, January 20, 2026. REUTERS/Romina Amato Purchase Licensing Rights, opens new tab

March 26 (Reuters) - Microsoft (MSFT.O), opens new tab executives ​have in recent ‌weeks told managers ​at ​major divisions, including ⁠its ​cloud unit ​and North American sales groups, ​to ​suspend new hiring, ‌The ⁠Information reported on Thursday, citing ​three ​employees ⁠with direct ​knowledge of ​the ⁠decision.",509,58,2026-03-26 23:37:38,wallstreetbets,https://www.reuters.com/business/world-at-work/microsoft-freezes-hiring-major-cloud-sales-groups-information-reports-2026-03-26/
1s461q6,Crypto backed mortgages,"I mean if you guys wanted a signal, this shit is smacking you in the face. 

Dropping 1.3mil dirtybubble73 coin on a downpayment, thats the banks problem if it rugs not me.",917,156,2026-03-26 17:57:21,wallstreetbets,https://www.msn.com/en-us/money/realestate/fannie-mae-to-accept-crypto-backed-mortgages-for-the-first-time/ar-AA1Zs5EQ?ocid=finance-verthp-feeds
1s3ukw1,Meta Lays off hundreds of employees,,3992,303,2026-03-26 07:30:03,wallstreetbets,https://www.nbcnews.com/tech/social-media/meta-layoffs-hundreds-employees-five-divisions-vr-ai-who-rcna265127
1s4bgik,100K Portfolio (22K in Gains today) SCALPING Options.,"Been quite the journey boys.  Never imagine I’d have made it to a 100K portfolio.  

Who knows what the fuck I do from here.  Definitely grabbing a drink after work today.",280,98,2026-03-26 21:27:12,wallstreetbets,https://www.reddit.com/gallery/1s4bgik
1s4h183,JOBY Loss Porn,I thot I will flip these for +$40k profit. But life wants to me keep struggling. See you on the other end fellas. Gonna buy more. Double my position with 2028 LEAPS. ,93,41,2026-03-27 00:48:29,wallstreetbets,https://i.redd.it/uaobrq7awfrg1.jpeg
1s4fcl2,Gains I should have had Monday,Locked in 75k 0DTE…will let the fridays ride,109,27,2026-03-26 23:46:41,wallstreetbets,https://i.redd.it/l9a8vie9lfrg1.jpeg
1s4ichq,Exercised an option just to have it reversed.,"Never had this happen before. Exercised a Palantir $150 call 3/27 today at opening. Shares were added to my account, the call option was gone and $15,000 buying power removed.

I checked in around 1pm everything normal besides all the red.

Checked at close to see what the damage was and my shares were gone, call option and cashed restored.

Who threw the reverse uno card?

Edit: it was excised in the money, below break even, thought process: take the shares and unrealized loss, sell CC’s til the rebound. ",73,53,2026-03-27 01:37:45,wallstreetbets,https://www.reddit.com/gallery/1s4ichq
1s4jzx5,Bear Thesis,"Alright lemme get my existential anxiety out in the form of a bear thesis:

Currently it seems like we’re headed for something bad. The concerns are threefold:

1.) Oil shock causing resurgent inflation

2.) Overvaluation of AI companies

3.) Concerns that many private credit loans are overestimated in value, and may in fact be worthless.

The oil shock is self explanatory enough, but it adds a layer of deeper concern to points 2 &amp; 3.

Let’s look at the big boys in the AI space. OpenAI, Anthropic, Google, MSFT, Meta. These are your folks pushing “frontier models”. Thing is the frontier model race isn’t looking like so much of a race at this point. Anthropic and OpenAI are pulling ahead of competitors (Google only slightly behind). Llama is declining in adoption as the other models continue to surpass it.

That’s not a huge concern though. If a bunch of companies are trying something new, you’ll have a handful of them actually succeed at scale. Normal stuff. Still, the eventual losers might be currently overvalued.

We have exciting tech coming out, OpenClaw is very cool, but it doesn’t add value to any company. It cuts costs, sure, but again, it’s essentially just a pre-built AI agent using a big boy’s LLM. No company will gain a unique advantage over any other by adopting this type of workflow, everyone will adopt it. It’s not a monetizable thing.

The greater concern are the thousands of AI “companies” that are little more than a GUI or wrapper for one of the big boys LLMs. I brought up AI receptionists in a previous comment. Dozens of companies. There are thousands of these bullshit companies in different niches, all one product update away from being obsolete.

Then you have Private Credit, and this is concerning on both ends, Big Boys and bullshit. First off, the jitters in private equity are serious. Consecutive quarters of loans going from 100 cents on the dollar to zero. That’s not a result of a material change in these businesses. The loans should never have been given in the first place.

Then you have OpenAI offering a guaranteed 17.5% return to private equity, when they’re not remotely profitable.

And this is all within the context of potentially resurgent inflation that may make the Fed unable to cut rates, and a massively increased debt to gdp ratio compared to 2020 or 2008 that makes massive stimulus far more difficult to perform.

It’s all very concerning.

Closed QQQ 585p 6/27 +250% today. Waiting to see tomorrow’s action. Likely reopening QQQ and SPY puts Monday, QQQ 560p sometime in April, not sure about SPY yet.

TL;DR (Courtesy of u/WakaWear): 

TL;DR:  

AI valuations look frothy, private credit looks mispriced, and an oil‑driven inflation rebound could trap the Fed.  

Most AI startups have no moat and could get wiped out by model updates.  

Macro + credit + AI hype together create a setup for a broader market pullback.  ",59,183,2026-03-27 02:39:39,wallstreetbets,https://www.reddit.com/r/wallstreetbets/comments/1s4jzx5/bear_thesis/
1s4g6e4,All in.,,86,54,2026-03-27 00:16:53,wallstreetbets,https://i.redd.it/lwrwemfnqfrg1.jpeg
1s4i7q2,5 bagger on SPY puts,Only threw $500 at it but I’m okay,50,13,2026-03-27 01:33:02,wallstreetbets,https://i.redd.it/dw2273h84grg1.jpeg
1s4jl6q,victoREE post,"3rd times the charm. Repost because didnt have trade history. Not gonna upload 12 screenshots of my shitty trades but I'll give a breakdown. Taking 14k out and taking a break is my current move. You can do it too regards

Feb 11 SPY puts, sold on the 12th 300-&gt;1000, deposited 2k
Feb 13 INTC calls, 2k -&gt; 2.5k sold same day
Feb 17 SPY calls 2.3k, averaged down Feb 18th with 900, cashed out same day for 4.5k
Feb 19th SMCI calls 5k, sold on Feb 20th for 7.2, also SPY calls 1 to 1.2k
Feb 23rd SPY puts 8k, sold same day for 10.8k
Feb 24th, SPY puts 11k, sold on Mar 3rd for 17k
Mar 4th INTU calls 13k -&gt; 20.5k sold on the 5th
Mar 6th 20k in calls, sold for 8k on the 9th before the run up, would have broke even if I held
Mar 10th TT puts 13.5k, sold on the 12th for 20k
Mar 13th TT puts again for 21k, sold on the 20th for 25k
Mar 20th SPY calls 25k, sold for 33 on the 23rd.

Started buying monthlies here instead of mostly weeklies

Mar 23rd SPY puts 33k, sold on the 24th for 37k
Mar 24th DELL put scalp, 32 to 34.5k, bought 38k of SPY puts, sold same day for 41k. Then SPY calls for 41k.
Mar 25th sold SPY calls for 49k, entered spy puts for 49k
Mar 26th sold puts for 53k. Then tried some SPY options, up to 59k and down to 54.5k

Im so fucking retarded for writing this shit out, hope yall enjoy. 🖕🖕🖕🖕🖕




",38,16,2026-03-27 02:24:15,wallstreetbets,https://www.reddit.com/gallery/1s4jl6q
1s44blv,"Daily Discussion Thread for March 26, 2026",This post contains content not supported on old Reddit. [Click here to view the full post](https://sh.reddit.com/r/wallstreetbets/comments/1s44blv),225,19575,2026-03-26 16:31:15,wallstreetbets,https://www.reddit.com/r/wallstreetbets/comments/1s44blv/daily_discussion_thread_for_march_26_2026/
1s4b3lm,what should i do?,"Does Robinhood stock have potential to bounce back at this point? I don’t want to sell, but at the same time I feel so stupid. I’m looking for suggestions.

This wasn’t meant to be a long-term play. I thought I would exit once the stock went up, but it’s gone down again and again.",82,179,2026-03-26 21:14:12,wallstreetbets,https://i.redd.it/tpt41nz1uerg1.jpeg
1s4jvn2,Brother in law recently learned about 0dte options..,Told him he belongs here. ,28,10,2026-03-27 02:35:12,wallstreetbets,https://i.redd.it/blgdmvqbfgrg1.jpeg
1s41bdi,"Daily General Discussion and Advice Thread - March 26, 2026","Have a general question? Want to offer some commentary on markets? Maybe you would just like to throw out a neat fact that doesn't warrant a self post? Feel free to post here!

Please consider consulting our FAQ first - [https://www.reddit.com/r/investing/wiki/faq](https://www.reddit.com/r/investing/wiki/faq) And our [side bar](https://www.reddit.com/r/investing/about/sidebar) also has useful resources.

If you are new to investing - please refer to Wiki - [Getting Started](https://www.reddit.com/r/investing/wiki/index/gettingstarted/)

The reading list in the wiki has a list of books ranging from light reading to advanced topics depending on your knowledge level. Link here - [Reading List](https://www.reddit.com/r/investing/wiki/readinglist)

The media list in the wiki has a list of reputable podcasts and videos - [Podcasts and Videos](https://www.reddit.com/r/investing/wiki/medialist)

If your question is ""I have $XXXXXXX, what do I do?"" or other ""advice for my personal situation"" questions, you should include relevant information, such as the following:

* How old are you? What country do you live in?
* Are you employed/making income? How much?
* What are your objectives with this money? (Buy a house? Retirement savings?)
* What is your time horizon? Do you need this money next month? Next 20yrs?
* What is your risk tolerance? (Do you mind risking it at blackjack or do you need to know its 100% safe?)
* What are you current holdings? (Do you already have exposure to specific funds and sectors? Any other assets?)
* Any big debts (include interest rate) or expenses?
* And any other relevant financial information will be useful to give you a proper answer.

Check the resources in the sidebar.

Be aware that these answers are just opinions of Redditors and should be used as a starting point for your research. You should strongly consider seeing a registered investment adviser if you need professional support before making any financial decisions!",8,6,2026-03-26 13:30:43,investing,https://www.reddit.com/r/investing/comments/1s41bdi/daily_general_discussion_and_advice_thread_march/
1q13q10,Investing and Trading Scam Reminder,"For those new to Reddit and to investing and trading - please be aware that social media platform like Reddit, Discord, etc. can be a vector for scams and fraud. 

Offers to DM should be viewed as suspicious. 

Social media platforms continue to be a common method to recruit new investors to scams. - do not assume that an offer to ""help"" is legitimate.

There are many dozens of types of scams - a list of scam types can be found in r/scams in the master list here: [/r/Scams Common Scam Master](https://www.reddit.com/r/Scams/comments/jij96c/rscams_common_scam_master_post/)

1. Good explanation of pig-buthering here - [Pig butchering - how to spot](https://dfpi.ca.gov/news/insights/pig-butchering-how-to-spot-and-report-the-scam/)
2. Legitimate investment advisors do not use WhatApp, Telegram, Discord, etc. to provide tips. In the US - it is against regulation - specifically SEC Rule 17a-4 and FINRA Rule 3110. For example - brokers in the US that use social media for support do not offer investment advice. 
3. It is common for bots and malicious actors on Discord to impersonate Reddit and Discord mods to distribute their scams. It is possible to create a Discord profile which appears similar to someone else.
4. Pump and dump of stocks are common on social media - bots or stock promoters who are seeking to profit from pumping a stock or to create hype. You can sometimes identify if it's a bot or promoter simply by looking at the posters comment and post history. Often you will see that the account has posted nothing related to investing or trading but suddenly there is the same or varying versions of comments on one or two specific stocks.
5. One other way to recognize suspicious posts is if the OP never engages in a discussion on comments and questions in the thread on their own dd. Those are all signs of stock promotion.
6. Offers to mirror trade and teach you how to trade are usually fake. If you receive private solicitations to open accounts at a broker or investment adviser, be wary.

Depending on where you live -  you can verify the legitimacy of a broker or investment adviser. Most countries have legal requirements for investment advisors and brokers to be registered. 

United States - check the registration status of a broker at the FINRA web site here - [https://brokercheck.finra.org/](https://brokercheck.finra.org/) You can check disclosures for investment advisers at the SEC IAPD web site here - [https://adviserinfo.sec.gov/](https://adviserinfo.sec.gov/)

United Kingdom - Financial Conduct Authority - [https://www.fca.org.uk/consumers/fca-firm-checker](https://www.fca.org.uk/consumers/fca-firm-checker) \- a warning list of fake companies can be found here - [https://www.fca.org.uk/consumers/warning-list-unauthorised-firms](https://www.fca.org.uk/consumers/warning-list-unauthorised-firms)

Canada - CIRO - [https://www.ciro.ca/office-investor/dealers-we-regulate](https://www.ciro.ca/office-investor/dealers-we-regulate)  

For those interested in understanding a little more about stock promoting and pump-and-dumps - one of the mods provided an AMA 15 years ago about a penny stock pump operation that he unwittingly became associated with - you can find the AMA here - [https://www.reddit.com/r/investing/comments/158vi7/i\_used\_to\_be\_a\_penny\_stock\_promoter\_in\_the\_late/](https://www.reddit.com/r/investing/comments/158vi7/i_used_to_be_a_penny_stock_promoter_in_the_late/)

If you believe that you or someone has been the victim of a trading or investing scam. Be aware of the following:

1. Do not send more money. Do not provide additional banking or credit card information. 
2. It is common to be contacted by additional scammers who may pretend to be law enforcement or private services to offer to ""recover"" funds for payment. This is a common follow-up scam. Law enforcement will never ask for money. 
3. If a login account was created. The password used is compromised. Change all passwords that are used. The password will be shared and sold to other scammers.  
4. If payment was sent via a credit card or bank transfer - report the transfers as fraud to your bank or credit card company.",42,19,2026-01-01 18:32:21,investing,https://www.reddit.com/r/investing/comments/1q13q10/investing_and_trading_scam_reminder/
1s4e0jz,"Are we about to see the biggest fire sale in Dubai real estate history, or is the 'fear' priced in?","Dubai has been selling this 'safe haven of the Middle East' vibe for years, but the recent Iran situation is really putting that to the test

 The panic is actually real... people went from aggressively buying off-plan to trying to cash out ASAP

So, are we about to see a massive real estate crash with money fleeing the region? Or is all this fear already priced in, and big players are just waiting to buy the dip? What do you guys think?

**For those asking for data, here is the official source for real-time market fluctuations**: https://dxbinteract.com/",316,93,2026-03-26 22:59:29,investing,https://www.reddit.com/r/investing/comments/1s4e0jz/are_we_about_to_see_the_biggest_fire_sale_in/
1s4k7jk,Current US Stock Market crisis,"Who all agrees with me that someone is tweeting a fake claim to bring up the prices, people start investing, then the market dumps back taking away all the money, and a couple of days later the same person comes up with a different claim. This is like a repeating cycle that has been occurring for the past couple of months.

IYKYK who the person is 😅",133,95,2026-03-27 02:47:51,investing,https://www.reddit.com/r/investing/comments/1s4k7jk/current_us_stock_market_crisis/
1s4hbs7,Which stock sectors will recover first when this war ends?,"The war with Iran has affected the market big time.

But all wars end.

When this one ends and the world economy claws out of the rubble, who do you think recovers first?

Or do you think this is the end of the current stock market system?

Personally I think that, with the cost oil oil and LNG going up, that energy and defensive stocks will remain the winners in 2026, as we drift to recession by 2027. ",21,57,2026-03-27 00:59:32,investing,https://www.reddit.com/r/investing/comments/1s4hbs7/which_stock_sectors_will_recover_first_when_this/
1s4gd6n,"I have the worst timing, maybe it will get better","self employed, max out Roth IRA every year. finally doing things. correctly and saving...have 60/40 domestic/international stock portfolio. tracks pretty closely s&amp;p 500...bought shares when it was right neat 7k. 

i will hold, but man is it rough when the first thing you do immediatly flips on its head. the desire to sell and hold on for the floor is overwhelming, but I'm going to hold. maybe I'll just delete my investing app and not look at it",22,34,2026-03-27 00:23:50,investing,https://www.reddit.com/r/investing/comments/1s4gd6n/i_have_the_worst_timing_maybe_it_will_get_better/
1s4l6x3,JPST/Corporate Bond Abnormal Movement Lately,"What is going on with Corporate Bond ETF?

Normally you would see a daily +0.0x% and then big drop at month end due to dividend payout. 

But JPST has been relatively flat for the past month. 

Meanwhile treasury ETFs like SGOV or SHV still look like normal cyclical movement. So that rules our fluctuation in interest rate for the cause.

Are we anticipating default in corporate bond or something?

",11,3,2026-03-27 03:25:56,investing,https://www.reddit.com/r/investing/comments/1s4l6x3/jpstcorporate_bond_abnormal_movement_lately/
1s4h0nx,The 10-Minute Read: What I Learned from 100+ Investors,"I discussed investors about the one principle they wished they understood earlier. Here’s the distilled wisdom.

1. **Start early.** Time is the only irreplaceable ingredient. A dollar invested at 25 is worth far more than one invested at 35. Automate your contributions and let the exponent work.
2. **Volatility is not risk.** Permanent capital loss is risk. A 50% loss requires a 100% gain to recover. Keep liquidity so you're never a forced seller.
3. **Boring is correct.** If your portfolio feels exciting, you're probably gambling. Low-cost index funds, dollar-cost averaging, and patience win over time.
4. **Behavior &gt; intelligence.** Most mistakes come from reacting at the wrong time; panic selling, holding losers, stopping contributions. Write a plan when you're calm and follow it when you're not.
5. **Cut losers, let winners run.** Most people do the opposite. Before adding to a losing position, ask: would I buy this today?
6. **Be honest about yourself.** The mortgage vs. invest debate is personal. The mathematically optimal choice doesn't matter if you can't stick to it.
7. **Stay humble.** You can't predict the market. Diversify, use index funds as your core, and admit mistakes quickly.

**The bottom line:** 

&gt;*Investing isn't about being right. It's about staying in the game long enough for compounding to work. Start early, control your behavior, and let time do the heavy lifting.*",10,8,2026-03-27 00:47:53,investing,https://www.reddit.com/r/investing/comments/1s4h0nx/the_10minute_read_what_i_learned_from_100/
1s3sqcl,I went through congressional trade filings from the week before the Iran war started. An Intelligence Committee member bought Exxon twice in early February and.....,"Josh Gottheimer is on the House Intelligence Committee.

2/2: Bought Exxon

2/4: Bought Exxon

2/27: Sold Palo Alto

Exxon is up 10% since

Sold a cybersecurity company stock the day before bombs dropped.

Looks like selling off after some wins and buying energy just before an Oil crisis.

More questions than answers but very fortunate timing to say the least.",330,33,2026-03-26 06:08:42,investing,https://www.reddit.com/r/investing/comments/1s3sqcl/i_went_through_congressional_trade_filings_from/
